{
  "schema": "uzpainter/parity/golden-private/1",
  "record_class": "private_oracle_record",
  "golden_id": "samples/tier0/defaults-and-template",
  "tier": "0",
  "note": "Synthetic sample for the schema tests: invented values and hashes, nothing recorded from Painter.",
  "key": {
    "inputs": [
      { "input_id": "plane", "sha256": "c2d449b6b97cc54dab7d00a61f1c3abb0e93c47f8e21b9d0770f06d40d9df43a" }
    ],
    "instruction_sequence_sha256": "ba8d4bc1aa2041f38fb3dedca5442101f7043a4c4c354f44d9ce8ce931420672",
    "effective_defaults": { "synthetic.default": "synthetic" },
    "painter_build": {
      "product": "Adobe Substance 3D Painter",
      "version": "12.1.0",
      "build_id": "synthetic-sample-build"
    },
    "project_settings": { "synthetic.template": "synthetic" },
    "resource_hashes": [
      { "resource": "synthetic-resource", "sha256": "3c1ff4fbad3f890a4d1f287142413bd505f7928bb8c550f07e37ca5e075b8dc2" }
    ],
    "bake_backend": "cpu",
    "render_state": null
  },
  "recordings": [
    {
      "recording_id": "r1",
      "condition": "same_session",
      "session_id": "synthetic-session-1",
      "recorded_at": "2026-10-10T12:00:00Z",
      "outputs": [
        {
          "output_id": "defaults/baking",
          "kind": "effective_default_capture",
          "subject": "synthetic baking defaults",
          "values": { "synthetic.parameter": 1.0 }
        },
        {
          "output_id": "template/synthetic",
          "kind": "template_capture",
          "subject": "synthetic template channel set",
          "values": { "synthetic.channel": "synthetic.format" }
        }
      ]
    },
    {
      "recording_id": "r2",
      "condition": "after_save_reopen",
      "session_id": "synthetic-session-2",
      "recorded_at": "2026-10-10T12:10:00Z",
      "outputs": [
        {
          "output_id": "defaults/baking",
          "kind": "effective_default_capture",
          "subject": "synthetic baking defaults",
          "values": { "synthetic.parameter": 1.0 }
        }
      ]
    }
  ]
}
